[
  {
    "id": "bala", "num": "I", "name_ru": "Балаканда", "iast": "Bālakāṇḍa", "devanagari": "बालकाण्ड",
    "title_ru": "Книга о детстве", "sargas": 77, "later_addition": true,
    "summary": "Обрамляющий рассказ о том, как Вальмики слагает поэму; рождение Рамы у царя Дашаратхи в Айодхье, детство и учение. С мудрецом Вишвамитрой братья побеждают демонов; Рама ломает лук Шивы и получает руку Ситы — четыре брата женятся."
  },
  {
    "id": "ayodhya", "num": "II", "name_ru": "Айодхьяканда", "iast": "Ayodhyākāṇḍa", "devanagari": "अयोध्याकाण्ड",
    "title_ru": "Книга об Айодхье", "sargas": 119, "later_addition": false,
    "summary": "Дашаратха готовит венчание Рамы на царство, но царица Кайкейи, напомнив о старых обещаниях, требует изгнать Раму на 14 лет и возвести на трон Бхарату. Рама уходит в лес с Ситой и Лакшманой; убитый горем Дашаратха умирает; Бхарата правит от имени Рамы, поставив на трон его сандалии."
  },
  {
    "id": "aranya", "num": "III", "name_ru": "Араньяканда", "iast": "Araṇyakāṇḍa", "devanagari": "अरण्यकाण्ड",
    "title_ru": "Книга о лесе", "sargas": 75, "later_addition": false,
    "summary": "Жизнь в лесу Дандака; ракшаси Шурпанакха изувечена, её брат Кхара убит. В отместку Равана с помощью золотого оленя (Маричи) похищает Ситу на Ланку; коршун Джатаю гибнет, пытаясь её спасти. Рама и Лакшмана начинают поиски."
  },
  {
    "id": "kishkindha", "num": "IV", "name_ru": "Кишкиндхаканда", "iast": "Kiṣkindhākāṇḍa", "devanagari": "किष्किन्धाकाण्ड",
    "title_ru": "Книга о Кишкиндхе", "sargas": 67, "later_addition": false,
    "summary": "Рама заключает союз с изгнанным царевичем обезьян Сугривой, убивает его брата Валина и возвращает Сугриве трон Кишкиндхи. Обезьянье войско рассылается на поиски Ситы во все стороны; южный отряд Ханумана узнаёт, что она на Ланке."
  },
  {
    "id": "sundara", "num": "V", "name_ru": "Сундараканда", "iast": "Sundarakāṇḍa", "devanagari": "सुन्दरकाण्ड",
    "title_ru": "Прекрасная книга", "sargas": 68, "later_addition": false,
    "summary": "Хануман перепрыгивает океан на Ланку, находит пленённую Ситу в роще Ашока и передаёт ей перстень Рамы. Он позволяет себя схватить, сжигает большую часть Ланки горящим хвостом и возвращается с вестью о месте и решимости Ситы."
  },
  {
    "id": "yuddha", "num": "VI", "name_ru": "Юддхаканда", "iast": "Yuddhakāṇḍa", "devanagari": "युद्धकाण्ड",
    "title_ru": "Книга о битве", "sargas": 128, "later_addition": false,
    "summary": "Войско Рамы наводит мост через океан на Ланку; великая битва завершается гибелью Раваны. Сита проходит испытание огнём (агни-парикша); Рама с Ситой и союзниками возвращаются в Айодхью на воцарение (паттабхишека).",
    "sargas_note": "По valmikiramayan.net — 128 сарг; в издании ИИТ-Канпур — 131; в критическом издании Бароды — 116 (расхождение рецензий)."
  },
  {
    "id": "uttara", "num": "VII", "name_ru": "Уттараканда", "iast": "Uttarakāṇḍa", "devanagari": "उत्तरकाण्ड",
    "title_ru": "Заключительная книга", "sargas": 111, "later_addition": true,
    "summary": "Долгое царствование Рамы; предыстория Раваны. Беременную Ситу, из-за народных сомнений в её чистоте, изгоняют в обитель Вальмики; она рождает Лаву и Кушу, которые позднее поют эпос Раме. Сказание завершается уходом Ситы в землю и Рамы из мира.",
    "sargas_note": "Южная рецензия (valmikiramayan.net) Уттараканду не публикует; ~111 сарг — по северной (ИИТ-Канпур/Горакхпур) традиции, в критическом издании — 100. Число зависит от рецензии."
  }
]
